"Amour interdit. Prostitution, marginalité et colonialisme. Maghreb (1830-1962)"
"Année: 2012 Auteur.ice: Christelle Taraud Discipline: Histoire Pays: France Thèmes: colonialisme, prostitution,
prostitution coloniale, prostituées, sexualité.s, travailleur.euse.s du sexe"
"Extraits et citations :"
"Quatrième de couverture :"
"Des prostituées, l'iconographie coloniale n'a montré qu'un fantasme : des parties de corps (visages dévoilés, seins nus,
sexes épilés, etc.) reproduites à l'infini sur des cartes postales pour collectionneurs. L'administration coloniale, elle, en fit
des femmes-machines, des objets érotiques standardisés, enfermés, surveillés dans des quartiers spécifiques. Et pourtant,
quand on les observe attentivement, ces femmes - pour l'essentiel des Algériennes, des Tunisiennes et des Marocaines de
confession musulmane - ne furent pas des objets passifs de l'histoire, mais de véritables actrices, pensantes, disantes,
agissantes. Certaines se rebellèrent d'ailleurs contre les hommes qui en situation de pouvoir voulaient leur imposer leurs
lois, transgressant aussi bien la caïda (tradition) que la morale coloniale..."
"Contexte :"
"Structure :"
"Analyse :"
"A propos de l’autrice Christelle Taraud :"
"Christelle Taraud est une historienne, enseignante dans les programmes parisiens de Columbia University et de NewYork University et membre associé du Centre d’histoire du XIXe siècle des Universités Paris I et Paris IV. Spécialiste desquestions de genre et de sexualité(s) dans les espaces coloniaux, tout particulièrement au Maghreb, elle a notammentpublié La prostitution coloniale. Algérie, Tunisie, Maroc (1830-1962) (Payot, 2009 [2003]), Mauresques. Femmesorientales dans la photographie coloniale (1860-1910) (Albin Michel, 2003) et « Amour interdit ». Prostitution,marginalité et colonialisme. Maghreb (1830-1962) (Payot, 2012). Elle a également coordonné l’ouvrage Féminicides -Une histoire mondiale (La Découverte, 2022)."
"Sources :"
"Pour aller plus loin :"
