"Le féminisme irréductible, discours sur la vie et la loi"
"Année: 2020 Auteur.ice: Catharine A. MacKinnon Discipline: Droit, Juridique Pays: Etats-Unis Thèmes: domination
masculine, harcèlement, harcèlement sexuel, violences, violences sexuelles"
"Extraits et citations :"
"Quatrième de couverture :"
"""Le féminisme irréductible - Discours sur la vie et sur la loi"", essai majeur de la théoricienne et militante américaine
Catherine MacKinnon, se porte aux racines de la misogynie et des violences exercées contre les femmes et éclaire de
manière inédite la construction des rapports sociaux de sexe. Pour l'autrice, la domination masculine est d'abord une
domination sexuelle qui s'inscrit ensuite dans le champ social, légitimant et renforçant ainsi la hiérarchie entre les
hommes et les femmes. Elle parle en ce sens de la violence sexuelle comme pratique sexuelle, des abus sexuels comme
forme de terreur, de l'éventualité du viol comme une caractéristique de la vie courante des femmes, de la pornographie et
de la prostitution comme instruments de soumission des femmes, des normes juridiques comme concourant au maintien
du statu quo au bénéfice des hommes... Par la force de ces analyses et par son action, Catharine MacKinnon a largement
fait évoluer le droit et la société américaine. Elle est ainsi, avec Andrea Dworkin, à l'origine aux États-Unis de la
première loi sur le harcèlement sexuel qui qualifie celui-ci de discrimination de sexe, et de la reconnaissance de la
pornographie et de la prostitution comme violences contre les femmes. Rassemblant des essais, élaborés à partir de
conférences données dans les années 1980, ce recueil, aujourd'hui en poche et publié pour la première fois en France en
2005, reste d'une actualité brûlante et est incontournable pour quiconque « cherche des réponses aux grandes questions
que pose la subordination des femmes aux hommes ». « ""La sexualité est au féminisme ce que le travail est au
marxisme : rien ne nous appartient davantage, et pourtant il n'est rien dont on ne soit davantage dépossédées."" [...]
Depuis vingt-cinq ans, aux États-Unis, le droit se trouve ébranlé par cette proposition de la juriste Catharine A."
"MacKinnon. » Éric Fassin, 2005."
"Contexte :"
"Structure :"
"Analyse :"
"A propos de l’autrice Catherine MacKinnon :"
"Catharine Alice MacKinnon est une avocate, écrivaine, juriste et féministe radicale américaine. Elle enseigne le droit."
"Elle est à l'origine de la définition du harcèlement sexuel dans la loi aux États-Unis."
"Engagée dans la mouvance du féminisme radical, elle publie en 1979 un rapport sur le harcèlement sexuel, SexualHarassment of Working Women : A Case of Sex Discrimination. Elle se fonde alors sur les discriminations sexuellesreconnues depuis la loi de 1964. Sa définition du harcèlement sexuel est à l'origine de la législation sur ce sujet auxÉtats-Unis, reconnue par la Cour suprême en 1986. À partir de 1983, Catharine MacKinnon commence à combattrela pornographie par des biais juridiques en travaillant avec Andrea Dworkin. Toutes deux rédigent une AntipornographyCivil Rights Ordinance qui vise à interdire la pornographie en tant que violation des droits des femmes, l'assimilant à uneforme de hate speech (« discours d'incitation à la haine »). Rejeté aux États-Unis, ce texte a cependant servi de référenceà la décision Butler de la Cour suprême du Canada en 1992, concernant la censure de la pornographie. MacKinnonpublie alors avec Andrea Dworkin In Harm’s Way: The Pornography Civil Rights Hearings, en 1997."
"Catharine MacKinnon propose une critique radicale de la domination masculine et de l'organisation patriarcale. Elle
refuse la distinction entre le sexe biologique et le genre définit comme la construction des identités des individus. Pour
elle, le biologique et le social sont indissociables et sont des constructions. Elle remet en cause l'idée que la sexualité est
naturelle et qu'il faudrait s'y adonner le plus possible. Pour démontrer cette idée forte, elle s'appuie sur des données qui
indiquent que dans la pornographie ce sont les rapports inégaux et la violence exercée sur les femmes qui excitent
sexuellement les hommes. Les femmes sont alors perçues comme des objets pour la satisfaction des hommes. Pour elle,
la domination masculine est d'abord sexuelle. Cette domination s'inscrit ensuite dans le social qui à son tour valorise la
sexualité et renforce la hiérarchie entre les femmes et les hommes. Socialement, les hommes sont les personnes qui
dominent sexuellement les femmes."
"Sources :"
"Wikipédia"
"Pour aller plus loin :"
