"Restons vivantes - Femmes, écologie et lutte pour la
survie"
"Année: 2022 Auteur.ice: Vandana Shiva Discipline: Anthropologie, Sociologie Pays: Inde Thèmes: accès à la terre,
altermondialisme, anti-capitalisme, développement, emprise coloniale, lutte, luttes paysannes, pensée décoloniale,
écoféminisme, écologie"
"Extraits et citations :"
"Quatrième de couverture :"
"Aux sources indiennes de l'écoféminisme"
"Partant d'une réflexion sur les sujets du développement, de l'écologie et du genre,Vandana Shiva met en lumière les liens
qui existent entre le colonialisme, la domination de la nature et l'oppression des femmes dans la société contemporaine."
"Depuis les années 1950, dans les pays du Sud, les pratiques monopolistiques des multinationales et les expropriations
conséquentes aux programmes de développement ont aggravé les processus coloniaux de dégradation écologique. Elles
ont privé les femmes de leur droit d'accès à la terre et aux ressources naturelles, contribuant à la destruction des
économies de subsistance des populations locales."
"Dans ce livre - publié pour la première fois en français trente ans après l'édition originale -,Vandana Shiva pose les bases
de l'écoféminisme en construisant une critique radicale du modèle occidental d'essor technologique et économique : le
« développement », présenté comme un futur souhaitable pour le monde entier, est en réalité un « mal-développement »,
fondé sur l'exploitation des femmes et de la nature. Face à un tel projet à la fois patriarcal et néocolonial, la seule issue
possible de survie et de libération pour la nature, comme pour les êtres humains, est celle de l'écologie, de l'harmonie, de
la durabilité et de la diversité."
"En s'inspirant des luttes paysannes en Inde,Vandana Shiva explore le rôle unique des femmes pour créer des alternatives
au modèle dominant, et ainsi sauvegarder les ressources vitales de la planète."
"Contexte :"
"Avec la participation de Agnès El Kaïm, Jeanne Burgart Goutal, Jeanne Burgart Goutal, Clotilde Bato"
"Structure :"
"Analyse :"
"A propos de l’autriceVandana Shiva :"
"Vandana Shiva est une conférencière, écrivaine et militante féministe et écoféministe indienne. Elle dirige la Fondation
de la recherche pour la science, les technologies et les ressources naturelles (""Research Foundation for Science,
Technology and Natural Resource Policy"")."
"Elle est docteur en philosophie de l'Université deWestern Ontario en 1978.Vandana Shiva est l'une des chefs de file des
écologistes de terrain et des altermondialistes au niveau mondial, notamment pour la défense de l'agriculture paysanne et
biologique face à la politique d'expansion des multinationales agro-alimentaires et aux effets pervers du génie génétique."
"Son site internet"
"Sources :"
"Pour aller plus loin :"
"Des écologistes remarquables, portraits : Vandana Shiva, l’écoféminisme contre la pauvreté, rfi, 07/08/2021"
"https://www.rfi.fr/fr/podcasts/des-écologistes-remarquables-portraits/20210807-vandana-shiva-l-écoféminisme-contre-la-pauvreté"
