"Tenir sa langue - Le langage, lieu de lutte féministe"
"Année: 2022 Auteur.ice: Julie Abbou Discipline: Linguistique, Sciences sociales Pays: France Thèmes: communication,
langage, langue française"
"Extraits et citations :"
"“Agir sur le langage pour agir sur le monde.Voilà le programme des mouvements sociaux qui s’engagent dans la lutte
pour la signification. Le féminisme a de longue date pris à bras-le-corps cette question de la langue, et pour cause : le
langage est un lieu majeur de notre catégorisation du monde. Il s’agit de contester la mainmise du masculin sur
l’humanité. Il s’agit de pouvoir s’énoncer, de participer au sens du monde à part pleine et entière. C’est dans cette
urgence politique et sémantique à pouvoir exister en tant que sujet humain, et à donner un autre sens à l’humanité, que
des féministes se sont mises à bousculer la grammaire.”"
"“Mais que faut-il pour oser s’attaquer ainsi au discours ? Pour faire irruption dans la grammaire ? Très certainement
autant de joie que de rage, mais aussi une compréhension du langage bien particulière. Une amitié profonde pour la
langue, une confiance en elle et en sa capacité transformatrice. Il faut quitter de manière définitive cette vision d’une
langue qui ne serait qu’un film transparent à déployer sur le monde pour l’étiqueter comme un morceau de viande au
congélateur. Il faut l’intime conviction que la langue n’est pas du cellophane, et que la réalité n’est pas un morceau de
viande. Mais que la langue est une proposition de monde. Prendre la parole, c’est toujours proposer un monde.”"
"Lire un extrait"
"Quatrième de couverture :"
"Comment le langage construit-il le genre et les sexualités - et inversement ? Cela fait bien longtemps que des féministes
ont pris la langue à bras-le-corps et bousculé la grammaire afin de contester la mainmise du masculin sur l'humanité, de
pouvoir participer pleinement au sens du monde. En revenant sur l'histoire politique du genre grammatical et en
observant les pratiques féministes du langage, Julie Abbou explore les possibles linguistiques pour en saisir la force de
transformation, mais aussi les limites."
"Loin des arguments hygiénistes ou corsetés sur la langue, elle déploie une politique du sens qui invite à la prolifération, à
un désordre du discours - qui incite à agir sur le langage pour agir sur le monde."
"Contexte :"
"Structure :"
"Analyse :"
"A propos de l’autrice Julie Abbou :"
"Julie Abbou est docteure en Sciences du Langage (Aix-Marseille Université) sur les modifications du genre linguistique
pour des motifs politiques, mon travail s'inscrit à l'interface de la sociolinguistique, de l'analyse de discours et de
l'anthropologie du langage. Elle mène des recherches sur les apports théoriques réciproques des études de genre et des
sciences du langage, sur les dimensions sémiotiques du genre grammatical, ainsi qu’en rhétorique sur le traitement
idéologique et discursif du genre dans différents types de discours. Elle travaille ces questions en lien avec les enjeux de
frontière, de migration, de solidarité ou encore de technologies. Elle a travaillé dans différents laboratoires, au LPL à
l'Université d'Aix-Marseille, au Département d'anglais de l'Université Polytechnique de Hong Kong, à l'Institut d'études
des femmes de l'Université d'Ottawa, au CREM à l'Université de Lorraine, au département de Lettres de Paris 13."
"Elle a co-fondé la revue GLAD!, une revue scientifique en accès ouvert consacrée aux questions de genre et de langage,et fait partie du projet ERC Starting Grant Formal models of social meaning and identity construction through language,porté par Heather Burnett. Source"
"Sources :"
"Pour aller plus loin :"
"Le genre, lieu discursif de l’hétérogène, Julie Abbou"
"Dans l’épaisseur d’une ligne - Explorer les frontières du genre, Julie Abbou,  Karim Hammou, Perrine Lachenal"
