"Vagabondes, voleuses, vicieuses - Adolescentes sous
contrôle, de la Libération à la libération sexuelle"
"Année: 2019 Auteur.ice: Véronique Blanchard Discipline: Histoire Pays: France Thèmes: injonctions, normes sociales,
sexualité.s"
"Extraits et citations :"
"Quatrième de couverture :"
"On ne naît pas déviante, on le devient."
"Qui sont Rose, Luce, Adèle et les autres «mauvaises filles» condamnées par la justice des mineures dans le Paris de
l’après-guerre? Cette enquête historique, nourrie de nombreux témoignages et archives inédites, nous permet
d’approcher au plus près le quotidien de ces filles, et les normes qui pèsent encore sur les mœurs d’aujourd’hui..."
"""Luce : « vagabonde » ; Adèle : « voleuse » ; Émilienne : « vicieuse ». Trois mots, qui valent rappel à l’ordre,
réquisitoire, sanction. Ou comment le langage, le système éducatif, la psychiatrie et l’institution judiciaire construisent le
féminin, en lui opposant des contre-modèles. Dans les années 1950 et 1960, une adolescente a tôt fait de virer «
mauvaise fille » : un flirt, une sortie au bal ou au café, voire une simple fugue de quelques heures peuvent suffire à
enclencher l’engrenage judiciaire, qui la conduit devant le juge des enfants. Beaucoup seront ensuite placées en internat,
hospitalisées, ou emprisonnées. Un mécanisme que Véronique Blanchard dévoile à travers l’analyse de centaines de
documents exhumés des archives du tribunal pour enfants de la Seine. Les voix des jeunes filles qui en surgissent
racontent autant de trajectoires brisées, de rêves réprimés — et de révoltes indomptées. Elles nous plongent dans les
coulisses de la fabrique du genre et des inégalités. Car si les lois ont évolué, si les regards portés sur le genre ont changé,
si les adolescentes d’aujourd’hui ne portent plus les mêmes prénoms, certains mécanismes, eux, perdurent : ces voix
n’ont aujourd’hui rien perdu de leur force subversive."""
"Contexte :"
"Structure :"
"Analyse :"
"A propos de l'autrice Véronique Blanchard :"
"Véronique Blanchard est historienne. Responsable du Centre « Enfants en Justice » de l’École nationale de Protectionjudiciaire de la jeunesse, un lieu consacré à l’histoire de la justice des enfants, elle est co-rédactrice en chef de la Revued’histoire de l’enfance « irrégulière », et co-auteure, avec David Niget, de Mauvaises filles. Incorrigibles et rebelles(Textuel, 2015)."
"Sources :"
"Pour aller plus loin :"
"Mauvaises filles. Incorrigibles et rebelles, Véronique Blanchard et David Niget, 2015, Textuel"
"Épisode 3 : Les filles violentes, déviantes ou dissidentes ? - Les enfants enfermés ou l'éducation sous contrainte (4
épisodes) - La série documentaire (LSD) par Perrine Kervran - France Culture"
"*La délinquance des adolescentes : une violence de genre ?* Article d’Olivier Moyano, Journal des psychologues n°263,déc-janv 2009"
"Délinquance des filles et délinquance des garçons : différence dans les comportements ou différence dans la gestion descomportements ? Une étude du point de vue des intervenants, par Catherine Lafrenière (Mémoire d’études supérieures encriminologie, 2012)"
"Arthur Vuattoux : Adolescents, adolescentes face à la justice pénale in Genèses, 2014 (n° 97)"
"Genre et rapports de pouvoir dans l'institution judiciaire : Enquête sur le traitement institutionnel des déviancesadolescentes par la justice pénale et civile dans la France contemporaine. Thèse de sociologie d’Arthur Vuattoux,Institut de Recherche Interdisciplinaire sur les enjeux Sociaux"
"Épisode 4 : Filles rebelles au XXème siècle - Vie de jeunes filles (4 épisodes) - La Fabrique de l'Histoire par Emmanuel
Laurentin - France Culture"
